{
  "schemaVersion": 1,
  "baseContract": "IMA-BASE-1",
  "baseTag": "dsh-v0.1.1-rc.2",
  "providerInjection": [
    "@deepseek-ai/dsh-client-connection",
    "@deepseek-ai/dsh-client-ui-settings-plugins"
  ],
  "deniedRuntimeIdentities": [],
  "tags": [
    {
      "tag": "dsh-v0.1.0-rc.7",
      "contract": "IMA-BASE-1",
      "interfaceFamily": "IMA-HIF-1",
      "adapter": "IMA-ADAPTER-LEGACY"
    },
    {
      "tag": "dsh-v0.1.0-rc.8",
      "contract": "IMA-BASE-1",
      "interfaceFamily": "IMA-HIF-1",
      "adapter": "IMA-ADAPTER-LEGACY"
    },
    {
      "tag": "dsh-v0.1.1-rc.1",
      "contract": "IMA-BASE-1",
      "interfaceFamily": "IMA-HIF-1",
      "adapter": "IMA-ADAPTER-LEGACY"
    },
    {
      "tag": "dsh-v0.1.1-rc.2",
      "contract": "IMA-BASE-1",
      "interfaceFamily": "IMA-HIF-1",
      "adapter": "IMA-ADAPTER-LEGACY"
    },
    {
      "tag": "dsh-v0.1.2-alpha.1",
      "contract": "IMA-BASE-1",
      "interfaceFamily": "IMA-HIF-2",
      "adapter": "IMA-ADAPTER-GATEWAY"
    },
    {
      "tag": "dsh-v0.1.2-alpha.2",
      "contract": "IMA-BASE-1",
      "interfaceFamily": "IMA-HIF-3",
      "adapter": "IMA-ADAPTER-GATEWAY"
    },
    {
      "tag": "dsh-v0.1.2-alpha.3",
      "contract": "IMA-BASE-1",
      "interfaceFamily": "IMA-HIF-3",
      "adapter": "IMA-ADAPTER-GATEWAY"
    },
    {
      "tag": "dsh-v0.1.2-alpha.4",
      "contract": "IMA-BASE-1",
      "interfaceFamily": "IMA-HIF-3",
      "adapter": "IMA-ADAPTER-GATEWAY"
    },
    {
      "tag": "dsh-v0.1.2-alpha.5",
      "contract": "IMA-BASE-1",
      "interfaceFamily": "IMA-HIF-3",
      "adapter": "IMA-ADAPTER-GATEWAY"
    },
    {
      "tag": "dsh-v0.1.2-rc.1",
      "contract": "IMA-BASE-1",
      "interfaceFamily": "IMA-HIF-3",
      "adapter": "IMA-ADAPTER-GATEWAY"
    },
    {
      "tag": "dsh-v0.1.3-alpha.1",
      "contract": "IMA-BASE-1",
      "interfaceFamily": "IMA-HIF-3",
      "adapter": "IMA-ADAPTER-GATEWAY"
    },
    {
      "tag": "dsh-v0.1.3-alpha.2",
      "contract": "IMA-BASE-1",
      "interfaceFamily": "IMA-HIF-3",
      "adapter": "IMA-ADAPTER-GATEWAY"
    },
    {
      "tag": "dsh-v0.1.5-alpha.1",
      "contract": "IMA-BASE-1",
      "interfaceFamily": "IMA-HIF-3",
      "adapter": "IMA-ADAPTER-GATEWAY"
    }
  ]
}
